{
  "$schema":"https://json-schema.org/draft/2020-12/schema", "$id":"m0a://schemas/narrative/context-manifest.r1.schema.json", "title":"ContextManifestR1", "type":"object",
  "properties":{
    "payloadSchema":{"const":"context-manifest.r1"}, "executionMode":{"type":"string","enum":["OPENING_BOOTSTRAP","LONG_FORM"]}, "compiledFromProjectRevision":{"type":"integer","minimum":0}, "compiledFromStateDigest":{"type":"string","pattern":"^[a-f0-9]{64}$"}, "goalContractRefs":{"type":"array","items":{"$ref":"../artifact/artifact-ref.schema.json"}}, "activeVolumeTaskRefs":{"type":"array","items":{"type":"string"}}, "continuityThreadRefs":{"type":"array","items":{"type":"string"}}, "futureReservationRefs":{"type":"array","items":{"type":"string"}}, "narrativeStateSources":{"type":"array","items":{"$ref":"narrative-definitions.schema.json#/$defs/SourceRef"}}, "selectedEvidence":{"type":"array","items":{"$ref":"narrative-definitions.schema.json#/$defs/EvidenceRef"}}, "hardSourceCount":{"type":"integer","minimum":0}, "omittedSoftSources":{"type":"array","items":{"$ref":"narrative-definitions.schema.json#/$defs/OmittedSource"}}, "budget":{"type":"object","properties":{"hardTokens":{"type":"integer","minimum":0},"softTokens":{"type":"integer","minimum":0},"totalTokens":{"type":"integer","minimum":0}},"required":["hardTokens","softTokens","totalTokens"],"additionalProperties":false}
  },
  "required":["payloadSchema","executionMode","compiledFromProjectRevision","compiledFromStateDigest","goalContractRefs","activeVolumeTaskRefs","continuityThreadRefs","futureReservationRefs","narrativeStateSources","selectedEvidence","hardSourceCount","omittedSoftSources","budget"], "additionalProperties":false
}
