{"payloadSchema":"context-manifest.r1","executionMode":"OPENING_BOOTSTRAP","compiledFromProjectRevision":0,"compiledFromStateDigest":"aaaaaaaaaaaaaaaaaaaaaaaaaaaaaaaaaaaaaaaaaaaaaaaaaaaaaaaaaaaaaaaa","goalContractRefs":[],"activeVolumeTaskRefs":[],"continuityThreadRefs":[],"futureReservationRefs":[],"narrativeStateSources":[],"selectedEvidence":[],"hardSourceCount":0,"omittedSoftSources":[],"budget":{"hardTokens":1,"softTokens":1,"totalTokens":2}}
